{
  "version": "2026-04-28",
  "frame_types": ["rx_forward16", "rx_forward24", "rx_backward", "tx_backward_local"],
  "forward16": {
    "special_commands": [
      {"match": {"type": "exact", "value": "0xA100"}, "name": "TERMINATE", "status": "decoded", "expects_backward": false},
      {"match": {"type": "mask", "mask": "0xFF00", "value": "0xA300"}, "name": "SET DTR0", "status": "decoded", "expects_backward": false},
      {"match": {"type": "mask", "mask": "0xFF00", "value": "0xA500"}, "name": "INITIALISE", "status": "decoded", "expects_backward": false, "send_twice": true},
      {"match": {"type": "exact", "value": "0xA700"}, "name": "RANDOMISE", "status": "decoded", "expects_backward": false, "send_twice": true},
      {"match": {"type": "exact", "value": "0xA900"}, "name": "COMPARE", "status": "decoded", "expects_backward": true},
      {"match": {"type": "exact", "value": "0xAB00"}, "name": "WITHDRAW", "status": "decoded", "expects_backward": false},
      {"match": {"type": "mask", "mask": "0xFF00", "value": "0xB100"}, "name": "SEARCHADDRH", "status": "decoded", "expects_backward": false},
      {"match": {"type": "mask", "mask": "0xFF00", "value": "0xB300"}, "name": "SEARCHADDRM", "status": "decoded", "expects_backward": false},
      {"match": {"type": "mask", "mask": "0xFF00", "value": "0xB500"}, "name": "SEARCHADDRL", "status": "decoded", "expects_backward": false},
      {"match": {"type": "mask", "mask": "0xFF00", "value": "0xB700"}, "name": "PROGRAM SHORT ADDRESS", "status": "decoded", "expects_backward": false},
      {"match": {"type": "mask", "mask": "0xFF00", "value": "0xB900"}, "name": "VERIFY SHORT ADDRESS", "status": "decoded", "expects_backward": true},
      {"match": {"type": "exact", "value": "0xBB00"}, "name": "QUERY SHORT ADDRESS", "status": "decoded", "expects_backward": true},
      {"match": {"type": "exact", "value": "0xBD00"}, "name": "PHYSICAL SELECTION", "status": "decoded", "expects_backward": false},
      {"match": {"type": "exact", "value": "0xC100"}, "name": "ENABLE DEVICE TYPE", "status": "decoded", "expects_backward": false}
    ],
    "opcode_table": [
      {"opcode": {"type": "exact", "value": "0x00"}, "name": "OFF", "status": "decoded", "expects_backward": false},
      {"opcode": {"type": "exact", "value": "0x01"}, "name": "UP", "status": "decoded", "expects_backward": false},
      {"opcode": {"type": "exact", "value": "0x02"}, "name": "DOWN", "status": "decoded", "expects_backward": false},
      {"opcode": {"type": "exact", "value": "0x03"}, "name": "STEP UP", "status": "decoded", "expects_backward": false},
      {"opcode": {"type": "exact", "value": "0x04"}, "name": "STEP DOWN", "status": "decoded", "expects_backward": false},
      {"opcode": {"type": "exact", "value": "0x05"}, "name": "RECALL MAX LEVEL", "status": "decoded", "expects_backward": false},
      {"opcode": {"type": "exact", "value": "0x06"}, "name": "RECALL MIN LEVEL", "status": "decoded", "expects_backward": false},
      {"opcode": {"type": "exact", "value": "0x07"}, "name": "STEP DOWN AND OFF", "status": "decoded", "expects_backward": false},
      {"opcode": {"type": "exact", "value": "0x08"}, "name": "ON AND STEP UP", "status": "decoded", "expects_backward": false},
      {"opcode": {"type": "exact", "value": "0x09"}, "name": "ENABLE DAPC SEQUENCE", "status": "decoded", "expects_backward": false},
      {"opcode": {"type": "exact", "value": "0x0A"}, "name": "GO TO LAST ACTIVE LEVEL", "status": "decoded", "expects_backward": false},
      {"opcode": {"type": "range", "start": "0x0B", "end": "0x0F"}, "name": "RESERVED 0x0B-0x0F", "status": "reserved", "expects_backward": false},
      {"opcode": {"type": "range", "start": "0x10", "end": "0x1F"}, "name": "GO TO SCENE", "status": "decoded", "expects_backward": false},
      {"opcode": {"type": "exact", "value": "0x20"}, "name": "RESET", "status": "decoded", "expects_backward": false, "send_twice": true},
      {"opcode": {"type": "exact", "value": "0x21"}, "name": "STORE ACTUAL LEVEL IN DTR0", "status": "decoded", "expects_backward": false, "send_twice": true},
      {"opcode": {"type": "exact", "value": "0x22"}, "name": "SAVE PERSISTENT VARIABLES", "status": "decoded", "expects_backward": false, "send_twice": true},
      {"opcode": {"type": "exact", "value": "0x23"}, "name": "SET OPERATING MODE", "status": "decoded", "expects_backward": false, "send_twice": true},
      {"opcode": {"type": "exact", "value": "0x24"}, "name": "RESET MEMORY BANK", "status": "decoded", "expects_backward": false, "send_twice": true},
      {"opcode": {"type": "exact", "value": "0x25"}, "name": "IDENTIFY DEVICE", "status": "decoded", "expects_backward": false},
      {"opcode": {"type": "exact", "value": "0x26"}, "name": "RESET POWER CYCLE SEEN", "status": "decoded", "expects_backward": false, "send_twice": true},
      {"opcode": {"type": "range", "start": "0x27", "end": "0x29"}, "name": "RESERVED 0x27-0x29", "status": "reserved", "expects_backward": false},
      {"opcode": {"type": "range", "start": "0x2A", "end": "0x2F"}, "name": "STORE DTR0 AS CONFIG", "status": "decoded", "expects_backward": false, "send_twice": true},
      {"opcode": {"type": "range", "start": "0x30", "end": "0x3F"}, "name": "STORE DTR0 AS SCENE", "status": "decoded", "expects_backward": false, "send_twice": true},
      {"opcode": {"type": "range", "start": "0x40", "end": "0x4F"}, "name": "REMOVE FROM SCENE", "status": "decoded", "expects_backward": false, "send_twice": true},
      {"opcode": {"type": "range", "start": "0x50", "end": "0x5F"}, "name": "ADD TO GROUP", "status": "decoded", "expects_backward": false, "send_twice": true},
      {"opcode": {"type": "range", "start": "0x60", "end": "0x6F"}, "name": "REMOVE FROM GROUP", "status": "decoded", "expects_backward": false, "send_twice": true},
      {"opcode": {"type": "exact", "value": "0x70"}, "name": "SET SHORT ADDRESS", "status": "decoded", "expects_backward": false, "send_twice": true},
      {"opcode": {"type": "exact", "value": "0x71"}, "name": "ENABLE WRITE MEMORY", "status": "decoded", "expects_backward": false, "send_twice": true},
      {"opcode": {"type": "range", "start": "0x72", "end": "0x7F"}, "name": "RESERVED 0x72-0x7F", "status": "reserved", "expects_backward": false},
      {"opcode": {"type": "range", "start": "0x80", "end": "0x8F"}, "name": "APPLICATION COMMAND SPACE", "status": "ambiguous", "expects_backward": false},
      {"opcode": {"type": "exact", "value": "0x90"}, "name": "QUERY STATUS", "status": "decoded", "expects_backward": true},
      {"opcode": {"type": "exact", "value": "0x91"}, "name": "QUERY CONTROL GEAR PRESENT", "status": "decoded", "expects_backward": true},
      {"opcode": {"type": "exact", "value": "0x92"}, "name": "QUERY LAMP FAILURE", "status": "decoded", "expects_backward": true},
      {"opcode": {"type": "exact", "value": "0x93"}, "name": "QUERY LAMP POWER ON", "status": "decoded", "expects_backward": true},
      {"opcode": {"type": "exact", "value": "0x94"}, "name": "QUERY LIMIT ERROR", "status": "decoded", "expects_backward": true},
      {"opcode": {"type": "exact", "value": "0x95"}, "name": "QUERY RESET STATE", "status": "decoded", "expects_backward": true},
      {"opcode": {"type": "exact", "value": "0x96"}, "name": "QUERY MISSING SHORT ADDRESS", "status": "decoded", "expects_backward": true},
      {"opcode": {"type": "exact", "value": "0x97"}, "name": "QUERY VERSION NUMBER", "status": "decoded", "expects_backward": true},
      {"opcode": {"type": "exact", "value": "0x98"}, "name": "QUERY CONTENT DTR0", "status": "decoded", "expects_backward": true},
      {"opcode": {"type": "exact", "value": "0x99"}, "name": "QUERY DEVICE TYPE", "status": "decoded", "expects_backward": true},
      {"opcode": {"type": "exact", "value": "0x9A"}, "name": "QUERY PHYSICAL MINIMUM LEVEL", "status": "decoded", "expects_backward": true},
      {"opcode": {"type": "exact", "value": "0x9B"}, "name": "QUERY POWER FAILURE", "status": "decoded", "expects_backward": true},
      {"opcode": {"type": "exact", "value": "0x9C"}, "name": "QUERY CONTENT DTR1", "status": "decoded", "expects_backward": true},
      {"opcode": {"type": "exact", "value": "0x9D"}, "name": "QUERY CONTENT DTR2", "status": "decoded", "expects_backward": true},
      {"opcode": {"type": "exact", "value": "0x9E"}, "name": "QUERY OPERATING MODE", "status": "decoded", "expects_backward": true},
      {"opcode": {"type": "exact", "value": "0x9F"}, "name": "QUERY LIGHT SOURCE TYPE", "status": "decoded", "expects_backward": true},
      {"opcode": {"type": "range", "start": "0xA0", "end": "0xA9"}, "name": "QUERY LEVEL/STATE", "status": "decoded", "expects_backward": true},
      {"opcode": {"type": "range", "start": "0xAA", "end": "0xAF"}, "name": "RESERVED 0xAA-0xAF", "status": "reserved", "expects_backward": true},
      {"opcode": {"type": "range", "start": "0xB0", "end": "0xBF"}, "name": "QUERY SCENE LEVEL", "status": "decoded", "expects_backward": true},
      {"opcode": {"type": "exact", "value": "0xC0"}, "name": "QUERY GROUPS 0-7", "status": "decoded", "expects_backward": true},
      {"opcode": {"type": "exact", "value": "0xC1"}, "name": "QUERY GROUPS 8-15", "status": "decoded", "expects_backward": true},
      {"opcode": {"type": "exact", "value": "0xC2"}, "name": "QUERY RANDOM ADDRESS H", "status": "decoded", "expects_backward": true},
      {"opcode": {"type": "exact", "value": "0xC3"}, "name": "QUERY RANDOM ADDRESS M", "status": "decoded", "expects_backward": true},
      {"opcode": {"type": "exact", "value": "0xC4"}, "name": "QUERY RANDOM ADDRESS L", "status": "decoded", "expects_backward": true},
      {"opcode": {"type": "exact", "value": "0xC5"}, "name": "READ MEMORY LOCATION", "status": "decoded", "expects_backward": true},
      {"opcode": {"type": "range", "start": "0xC6", "end": "0xDF"}, "name": "RESERVED 0xC6-0xDF", "status": "reserved", "expects_backward": true},